{
  "lho_id": "LHO-001",
  "title": "Always use Python tool for CSV parsing",
  "trigger_pattern": "task contains 'CSV' OR task contains 'parse data' AND file_extension == '.csv'",
  "correction_strategy": "Before parsing CSV file, always use the python_csv MCP tool instead of regex or string manipulation. The python_csv tool handles edge cases (quoted commas, newlines in fields, encoding issues) that regex cannot.",
  "priority": "high",
  "created_at": "2025-12-04T13:30:00Z",
  "faux_pas_source": "FP-2025-12-04-001",
  "success_count": 0,
  "tags": ["csv", "file_operations", "data_parsing"],
  "archived": false
}